{
  "summary": {
    "boardDate": "2026-06-14",
    "assignmentRecords": 11,
    "assigned": 8,
    "open": 3,
    "sourceTypes": 6,
    "historyEvents": 8,
    "linkedDailyBoardSpots": 11
  },
  "filters": {
    "date": "2026-06-14",
    "agency": "All agencies",
    "status": "All statuses",
    "source": "All sources"
  },
  "records": [
    {
      "id": "assign-20260614-dispatch-days-d1",
      "date": "2026-06-14",
      "agencyId": "agency-central-dispatch",
      "agency": "Central Dispatch Center",
      "shiftId": "dispatch-days-2026-06-14",
      "shift": "Days",
      "time": "0700-1900",
      "role": "Dispatcher",
      "spotCode": "D1",
      "spotLabel": "Police Radio",
      "employeeId": "emp-dispatch-001",
      "employee": "Morgan Price",
      "source": "pattern",
      "status": "assigned",
      "coverageImpact": "filled",
      "relatedRecordId": "pattern-a-days-001",
      "notes": "Generated from assigned pattern."
    },
    {
      "id": "assign-20260614-dispatch-days-d2",
      "date": "2026-06-14",
      "agencyId": "agency-central-dispatch",
      "agency": "Central Dispatch Center",
      "shiftId": "dispatch-days-2026-06-14",
      "shift": "Days",
      "time": "0700-1900",
      "role": "Dispatcher",
      "spotCode": "D2",
      "spotLabel": "Fire Radio",
      "employeeId": "emp-dispatch-002",
      "employee": "Riley Brooks",
      "source": "pattern",
      "status": "assigned",
      "coverageImpact": "filled",
      "relatedRecordId": "pattern-a-days-002",
      "notes": "Generated from assigned pattern."
    },
    {
      "id": "assign-20260614-dispatch-days-d3",
      "date": "2026-06-14",
      "agencyId": "agency-central-dispatch",
      "agency": "Central Dispatch Center",
      "shiftId": "dispatch-days-2026-06-14",
      "shift": "Days",
      "time": "0700-1900",
      "role": "Dispatcher",
      "spotCode": "D3",
      "spotLabel": "Calltaking",
      "employeeId": null,
      "employee": null,
      "source": "vacancy",
      "status": "open",
      "coverageImpact": "open",
      "relatedRecordId": null,
      "notes": "Open coverage. Eligible for open shift or mandate workflow later."
    },
    {
      "id": "assign-20260614-dispatch-days-d4",
      "date": "2026-06-14",
      "agencyId": "agency-central-dispatch",
      "agency": "Central Dispatch Center",
      "shiftId": "dispatch-days-2026-06-14",
      "shift": "Days",
      "time": "0700-1900",
      "role": "Dispatcher",
      "spotCode": "D4",
      "spotLabel": "Calltaking",
      "employeeId": null,
      "employee": null,
      "source": "pending overtime",
      "status": "open",
      "coverageImpact": "open",
      "relatedRecordId": "open-shift-20260614-d4",
      "notes": "Posted to overtime board but not filled yet."
    },
    {
      "id": "assign-20260614-dispatch-days-s1",
      "date": "2026-06-14",
      "agencyId": "agency-central-dispatch",
      "agency": "Central Dispatch Center",
      "shiftId": "dispatch-days-2026-06-14",
      "shift": "Days",
      "time": "0700-1900",
      "role": "Supervisor",
      "spotCode": "S1",
      "spotLabel": "Shift Supervisor",
      "employeeId": null,
      "employee": null,
      "source": "vacancy",
      "status": "open",
      "coverageImpact": "under-minimum",
      "relatedRecordId": null,
      "notes": "Supervisor minimum is not met."
    },
    {
      "id": "assign-20260614-dispatch-nights-n3",
      "date": "2026-06-14",
      "agencyId": "agency-central-dispatch",
      "agency": "Central Dispatch Center",
      "shiftId": "dispatch-nights-2026-06-14",
      "shift": "Nights",
      "time": "1900-0700",
      "role": "Dispatcher",
      "spotCode": "N3",
      "spotLabel": "Calltaking",
      "employeeId": "emp-dispatch-005",
      "employee": "Taylor Grant",
      "source": "overtime",
      "status": "assigned",
      "coverageImpact": "filled",
      "relatedRecordId": "vot-accepted-001",
      "notes": "Filled by voluntary overtime acceptance."
    },
    {
      "id": "assign-20260614-jail-days-c2",
      "date": "2026-06-14",
      "agencyId": "agency-kcso-corrections",
      "agency": "Kankakee County Sheriff's Office",
      "shiftId": "jail-days-2026-06-14",
      "shift": "Days",
      "time": "0600-1800",
      "role": "Correctional Officer",
      "spotCode": "C2",
      "spotLabel": "Housing Unit A",
      "employeeId": null,
      "employee": null,
      "source": "leave",
      "status": "open",
      "coverageImpact": "under-minimum",
      "relatedRecordId": "leave-approved-20260614-001",
      "notes": "Original assignment removed by approved leave request."
    },
    {
      "id": "assign-20260614-jail-days-c3",
      "date": "2026-06-14",
      "agencyId": "agency-kcso-corrections",
      "agency": "Kankakee County Sheriff's Office",
      "shiftId": "jail-days-2026-06-14",
      "shift": "Days",
      "time": "0600-1800",
      "role": "Correctional Officer",
      "spotCode": "C3",
      "spotLabel": "Transport",
      "employeeId": "emp-kcso-002",
      "employee": "Taylor Morgan",
      "source": "override",
      "status": "assigned",
      "coverageImpact": "filled",
      "relatedRecordId": "override-20260614-transport",
      "notes": "Admin override to cover transport detail."
    }
  ],
  "sourceTypes": [
    { "key": "pattern", "label": "Pattern", "description": "Normal recurring schedule assignment." },
    { "key": "overtime", "label": "Overtime", "description": "Voluntary or assigned overtime fills a spot." },
    { "key": "trade", "label": "Trade", "description": "Shift trade or swap changes the assigned employee." },
    { "key": "override", "label": "Override", "description": "Supervisor or admin manual change." },
    { "key": "leave", "label": "Leave", "description": "Approved leave removes or opens coverage." },
    { "key": "training", "label": "Training", "description": "Training detail changes normal coverage." }
  ],
  "history": [
    { "assignmentId": "assign-20260614-jail-days-c2", "at": "2026-06-10T14:20:00Z", "event": "pattern_assigned", "label": "Pattern assignment created", "actor": "System" },
    { "assignmentId": "assign-20260614-jail-days-c2", "at": "2026-06-12T16:44:00Z", "event": "leave_approved", "label": "Leave approved and spot opened", "actor": "Supervisor" },
    { "assignmentId": "assign-20260614-dispatch-nights-n3", "at": "2026-06-13T11:15:00Z", "event": "open_shift_posted", "label": "Open shift posted", "actor": "Admin" },
    { "assignmentId": "assign-20260614-dispatch-nights-n3", "at": "2026-06-13T13:05:00Z", "event": "overtime_accepted", "label": "Taylor Grant accepted voluntary overtime", "actor": "Taylor Grant" }
  ],
  "rules": [
    "Assignment records link a date, agency, shift, role, numbered coverage spot, employee, source, and status.",
    "The assignment engine preserves source context so the board can explain whether a record came from pattern, overtime, trade, override, leave, training, callback, or mandate.",
    "Open records are first-class records. An unfilled spot should still exist so coverage shortages can be counted and routed into open shift, callback, or mandation workflows.",
    "This release is read-only foundation data. Live assignment writes, drag/drop, and automatic pattern generation remain future work."
  ]
}
